{
    "profileUrl":"https://ic3.dev/test1.json",
    "linkedSchemas":[
       "demo-v1"
    ],
    "name":"IC3 Dev",
    "url":"https://ic3.dev",
    "mission":"We make stuff...",
    "geolocation":{
       "latitude": 12.121212,
       "longitude": 13.131313
    },
    "keywords":[
       "open-source",
       "beer"
    ]
 }
